{
  "$schema": "https://json-schema.org/draft/2020-12/schema",
  "$id": "https://gtublog.dev/contracts/automation/v4/claim-response.schema.json",
  "type": "object", "additionalProperties": false,
  "required": ["jobId", "jobKey", "runId", "topicId", "leaseOwner", "leaseExpiresAt", "providerName", "promptVersion", "schemaVersion", "prompt", "snapshots", "taxonomyCatalog"],
  "properties": {
    "jobId": { "type": "integer", "minimum": 1 }, "jobKey": { "type": "string", "minLength": 1, "maxLength": 36 },
    "runId": { "type": "integer", "minimum": 1 }, "topicId": { "type": "integer", "minimum": 1 },
    "leaseOwner": { "type": "string", "minLength": 1, "maxLength": 120 }, "leaseExpiresAt": { "type": "string", "format": "date-time" },
    "providerName": { "type": "string", "minLength": 1, "maxLength": 64 }, "promptVersion": { "type": "string", "minLength": 1, "maxLength": 64 },
    "schemaVersion": { "const": "automation-job-v4" }, "prompt": { "type": "string", "minLength": 1, "maxLength": 100000 },
    "taxonomyCatalog": { "type": "object", "additionalProperties": false, "required": ["categories", "tags"], "properties": {
      "categories": { "type": "array", "minItems": 1, "maxItems": 100, "items": { "$ref": "#/$defs/taxonomyTerm" } },
      "tags": { "type": "array", "minItems": 1, "maxItems": 200, "items": { "$ref": "#/$defs/taxonomyTerm" } }
    } },
    "snapshots": { "type": "array", "minItems": 2, "maxItems": 100, "items": {
      "type": "object", "additionalProperties": false,
      "required": ["snapshotId", "sourceUrl", "canonicalUrl", "title", "originHost", "bodyExcerpt", "contentHash", "retrievedAt"],
      "properties": {
        "snapshotId": { "type": "integer", "minimum": 1 }, "sourceUrl": { "type": "string", "format": "uri", "maxLength": 2048 },
        "canonicalUrl": { "type": "string", "format": "uri", "maxLength": 2048 }, "title": { "type": ["string", "null"], "maxLength": 300 },
        "originHost": { "type": "string", "minLength": 1, "maxLength": 253 }, "bodyExcerpt": { "type": ["string", "null"], "maxLength": 1000 },
        "contentHash": { "type": "string", "pattern": "^[0-9a-f]{64}$" }, "retrievedAt": { "type": "string", "format": "date-time" }
      }
    } }
  },
  "$defs": { "taxonomyTerm": { "type": "object", "additionalProperties": false, "required": ["id", "slug", "name"], "properties": {
    "id": { "type": "integer", "minimum": 1 }, "slug": { "type": "string", "minLength": 1, "maxLength": 120 }, "name": { "type": "string", "minLength": 1, "maxLength": 120 }
  } } }
}
